{
  "fixtureId": "07-kuwait-kwd",
  "title": "Kuwait KWD invoice",
  "tests": "Three-decimal values with no assumed VAT line.",
  "language": "en",
  "direction": "ltr",
  "supplier": {
    "name": "Fictional Kuwait Dry Goods WLL",
    "legalName": "Fictional Kuwait Dry Goods WLL",
    "address": "Shuwaikh Industrial, Kuwait",
    "taxRegistration": null
  },
  "billTo": "Example Kuwait Grocery Co., Kuwait City",
  "invoiceNumber": "INV-2026-007",
  "invoiceDate": "2026-08-07",
  "currency": "KWD",
  "taxLabel": null,
  "taxRate": null,
  "subtotal": 46.5,
  "discount": 0,
  "tax": 0,
  "freight": 0,
  "duty": 0,
  "total": 46.5,
  "notes": [
    "No VAT line is printed. Extractors must not invent a tax amount.",
    "Keep three decimal places for KWD."
  ],
  "lines": [
    {
      "description": "Basmati Rice 5kg",
      "supplierSku": "SUP-RIC-5KG",
      "barcode": "6270000000013",
      "quantity": 8,
      "unit": "EA",
      "unitPrice": 4.125,
      "discount": 0,
      "tax": 0,
      "lineTotal": 33
    },
    {
      "description": "Cooking Oil 1.8L",
      "supplierSku": "SUP-OIL-18",
      "barcode": "6270000000020",
      "quantity": 6,
      "unit": "EA",
      "unitPrice": 2.25,
      "discount": 0,
      "tax": 0,
      "lineTotal": 13.5
    }
  ]
}
