{
  "fixtureId": "10-invoice-discount",
  "title": "Invoice-level discount",
  "tests": "An overall discount for allocation logic.",
  "language": "en",
  "direction": "ltr",
  "supplier": {
    "name": "Fictional Gulf Foods LLC",
    "legalName": "Fictional Gulf Foods LLC",
    "address": "Warehouse 12, Al Quoz, Dubai, United Arab Emirates",
    "taxRegistration": "100123456700003"
  },
  "billTo": "Example Grocery Trading LLC, Dubai",
  "invoiceNumber": "INV-2026-010",
  "invoiceDate": "2026-08-10",
  "currency": "AED",
  "taxLabel": "VAT 5%",
  "taxRate": 0.05,
  "subtotal": 730,
  "discount": 73,
  "tax": 32.85,
  "freight": 0,
  "duty": 0,
  "total": 689.85,
  "notes": [
    "AED 73.00 (10%) invoice-level discount applied after line totals."
  ],
  "lines": [
    {
      "description": "Black Tea 100 bags",
      "supplierSku": "SUP-TEA-100",
      "barcode": "6290000000405",
      "quantity": 20,
      "unit": "EA",
      "unitPrice": 12,
      "discount": 0,
      "tax": 0,
      "lineTotal": 240
    },
    {
      "description": "Honey 500g",
      "supplierSku": "SUP-HON-500",
      "barcode": "6290000000412",
      "quantity": 15,
      "unit": "EA",
      "unitPrice": 18,
      "discount": 0,
      "tax": 0,
      "lineTotal": 270
    },
    {
      "description": "Mixed Nuts 250g",
      "supplierSku": "SUP-NUT-250",
      "barcode": "6290000000429",
      "quantity": 10,
      "unit": "EA",
      "unitPrice": 22,
      "discount": 0,
      "tax": 0,
      "lineTotal": 220
    }
  ]
}
