{
  "fixtureId": "13-free-of-charge",
  "title": "Free-of-charge / bonus quantity",
  "tests": "Charged for 10, delivered 12.",
  "language": "en",
  "direction": "ltr",
  "supplier": {
    "name": "Fictional Gulf Foods LLC",
    "legalName": "Fictional Gulf Foods LLC",
    "address": "Warehouse 12, Al Quoz, Dubai, United Arab Emirates",
    "taxRegistration": "100123456700003"
  },
  "billTo": "Example Grocery Trading LLC, Dubai",
  "invoiceNumber": "INV-2026-013",
  "invoiceDate": "2026-08-13",
  "currency": "AED",
  "taxLabel": "VAT 5%",
  "taxRate": 0.05,
  "subtotal": 95,
  "discount": 0,
  "tax": 4.75,
  "freight": 0,
  "duty": 0,
  "total": 99.75,
  "notes": [
    "Charged quantity is 10. Delivered quantity is 12, including 2 free-of-charge units."
  ],
  "lines": [
    {
      "description": "Tomato Paste 400g",
      "supplierSku": "SUP-TOM-400",
      "barcode": "6290000000702",
      "quantity": 10,
      "unit": "EA",
      "unitPrice": 9.5,
      "discount": 0,
      "tax": 0,
      "lineTotal": 95,
      "deliveredQuantity": 12,
      "freeOfChargeQuantity": 2
    }
  ]
}
